{
  "$schema": "tax-data.schema.json",
  "reta": {
    "rate": 0.314,
    "minQuota": 2700,
    "table": [
      { "limit": 670, "base": 653.59 },
      { "limit": 900, "base": 718.95 },
      { "limit": 1166.7, "base": 849.67 },
      { "limit": 1300, "base": 950.98 },
      { "limit": 1500, "base": 960.78 },
      { "limit": 1700, "base": 960.78 },
      { "limit": 1850, "base": 1143.79 },
      { "limit": 2030, "base": 1209.15 },
      { "limit": 2330, "base": 1274.51 },
      { "limit": 2760, "base": 1356.21 },
      { "limit": 3190, "base": 1437.91 },
      { "limit": 3620, "base": 1519.61 },
      { "limit": 4050, "base": 1601.31 },
      { "limit": 6000, "base": 1732.03 },
      { "limit": null, "base": 1928.10 }
    ]
  },
  "deductions": {
    "healthInsuranceLimitPerPerson": 500,
    "diffJustification": {
      "rate": 0.07,
      "societarioRate": 0.03,
      "max": 2000,
      "societarioMax": 2000
    },
    "pension": {
      "individualMax": 1500,
      "autonomousMax": 4250,
      "totalRateLimit": 0.3
    },
    "lowIncome": {
      "limit1": 14047.5,
      "limit2": 19747.5,
      "maxReduction": 6498,
      "factor": 1.14
    },
    "ngo": {
      "limit1": 250,
      "rate1": 0.8,
      "rate2": 0.4,
      "baseLimitRate": 0.1
    }
  },
  "minPersonal": {
    "base": 5550,
    "over65": 1150,
    "over75": 2550,
    "children": [2400, 2700, 4000, 4500]
  },
  "irpf": {
    "withholdingRate": 0.15,
    "stateScale": [
      { "l": 12450, "r": 0.095 },
      { "l": 20200, "r": 0.12 },
      { "l": 35200, "r": 0.15 },
      { "l": 60000, "r": 0.185 },
      { "l": 300000, "r": 0.225 },
      { "l": null, "r": 0.245 }
    ],
    "regionalScales": {
      "common": [
        { "l": 12450, "r": 0.095 },
        { "l": 20200, "r": 0.12 },
        { "l": 35200, "r": 0.15 },
        { "l": 60000, "r": 0.185 },
        { "l": 300000, "r": 0.225 },
        { "l": null, "r": 0.245 }
      ],
      "madrid": [
        { "l": 12960, "r": 0.085 },
        { "l": 18222, "r": 0.107 },
        { "l": 34041, "r": 0.128 },
        { "l": 54959, "r": 0.174 },
        { "l": null, "r": 0.205 }
      ],
      "andalucia": [
        { "l": 13000, "r": 0.095 },
        { "l": 21000, "r": 0.12 },
        { "l": 35000, "r": 0.15 },
        { "l": 60000, "r": 0.185 },
        { "l": null, "r": 0.225 }
      ],
      "cataluna": [
        { "l": 12450, "r": 0.105 },
        { "l": 17707, "r": 0.12 },
        { "l": 21000, "r": 0.14 },
        { "l": 33007, "r": 0.185 },
        { "l": 53407, "r": 0.215 },
        { "l": 90000, "r": 0.235 },
        { "l": 120000, "r": 0.245 },
        { "l": null, "r": 0.255 }
      ],
      "valencia": [
        { "l": 12450, "r": 0.09 },
        { "l": 17000, "r": 0.11 },
        { "l": 30000, "r": 0.14 },
        { "l": 50000, "r": 0.18 },
        { "l": null, "r": 0.225 }
      ],
      "galicia": [
        { "l": 12450, "r": 0.09 },
        { "l": 20200, "r": 0.115 },
        { "l": 35200, "r": 0.145 },
        { "l": 60000, "r": 0.185 },
        { "l": null, "r": 0.225 }
      ],
      "murcia": [
        { "l": 12450, "r": 0.094 },
        { "l": 20200, "r": 0.118 },
        { "l": 34000, "r": 0.148 },
        { "l": 60000, "r": 0.183 },
        { "l": null, "r": 0.225 }
      ],
      "canarias": [
        { "l": 12450, "r": 0.09 },
        { "l": 17707, "r": 0.12 },
        { "l": 33007, "r": 0.14 },
        { "l": 53407, "r": 0.185 },
        { "l": 90000, "r": 0.235 },
        { "l": 120000, "r": 0.25 },
        { "l": null, "r": 0.26 }
      ]
    }
  }
}
